{
  "slug": "why-is-bisexuality-becoming-mainstream",
  "title": "Why Is Bisexuality Becoming Mainstream?",
  "url": "https://www.historyfuturenow.com/articles/why-is-bisexuality-becoming-mainstream",
  "part": "Society",
  "posts": {
    "hook": {
      "platform": "twitter",
      "text": "Interracial relationships happened on screen, in an era where most of the US south still had laws preventing blacks and whites from marrying.",
      "link": "https://www.historyfuturenow.com/articles/why-is-bisexuality-becoming-mainstream",
      "full": "Interracial relationships happened on screen, in an era where most of the US south still had laws preventing blacks and whites from marrying. https://www.historyfuturenow.com/articles/why-is-bisexuality-becoming-mainstream"
    },
    "thread": {
      "platform": "twitter",
      "tweets": [
        "ðŸ§µ Greyâ€™s Anatomy, a TV series set in a Seattle hospital, has a senior female surgeon hopping into bed with a male colleague and then hopping into bed with a female colleague, whom she eventually marries.",
        "Full article: https://www.historyfuturenow.com/articles/why-is-bisexuality-becoming-mainstream"
      ]
    },
    "linkedin_essay": {
      "platform": "linkedin",
      "text": "Greyâ€™s Anatomy, a TV series set in a Seattle hospital, has a senior female surgeon hopping into bed with a male colleague and then hopping into bed with a female colleague, whom she eventually marries. Â Scandal, a TV series set amongst the politics and backstabbing of the Washington DC elite, has the presidentâ€™s male chief of staff get married to his long-term male lover. Â He was once married to a woman.\n\nTheir transformation to homosexuality is open and non-controversial. Sometimes their sexual orientation is straight, sometimes gay. Both lead characters are, in fact, bisexual.\n\nTV has always both reflected society and has shown it how it ought to be. Â The original Star Trek series was controversial in its portrayal of blacks and women in senior officer positions. Â Interracial relationships happened on screen, in an era where most of the US south still had laws preventing blacks and whites from marrying. Â TV and movies showed black Presidents long before Obama.Â  Female Presidents on screen are yet to be followed by real world female counterparts. Â Hillary Clinton is likely to become the first female US President.\n\nRead the full essay: https://www.historyfuturenow.com/articles/why-is-bisexuality-becoming-mainstream\n\n#Society #Demographics #Culture #HistoryFutureNow #LongRead",
      "hashtags": [
        "#Society",
        "#Demographics",
        "#Culture",
        "#HistoryFutureNow",
        "#LongRead"
      ]
    },
    "provocative_question": {
      "platform": "twitter",
      "text": "Why Is Bisexuality Becoming Mainstream?"
    },
    "quote_card": {
      "platform": "both",
      "text": "Jobs that have now disappeared to other parts of the world and been lost to automation.",
      "char_count": 87
    }
  }
}